{
  "$schema": "https://json-schema.org/draft/2020-12/schema",
  "$id": "urn:udl-content-spec:v1:item",
  "title": "Item 題目",
  "description": "給學生「作答」的東西。kind=fixed 寫死題幹與答案；kind=generated 只寫產生器與參數，由規格 repo 的產生器在執行時出題。題型專屬欄位在此只有最小定義，計分函式在 question-types/。",
  "type": "object",
  "required": [
    "format_version",
    "id",
    "unit",
    "type",
    "kind",
    "skill",
    "difficulty",
    "ladder_ids"
  ],
  "properties": {
    "format_version": {
      "const": 1
    },
    "id": {
      "$ref": "urn:udl-content-spec:v1:common#/$defs/id"
    },
    "unit": {
      "$ref": "urn:udl-content-spec:v1:common#/$defs/id"
    },
    "type": {
      "type": "string",
      "enum": [
        "choice",
        "true-false",
        "match",
        "numeric",
        "blanks",
        "ordering",
        "classify"
      ]
    },
    "kind": {
      "type": "string",
      "enum": [
        "fixed",
        "generated"
      ]
    },
    "skill": {
      "type": "string",
      "minLength": 1,
      "description": "報表顯示用分類（例如 詞語理解、計算）；對接 kit 用 ladder_ids／curriculum_codes。"
    },
    "difficulty": {
      "$ref": "urn:udl-content-spec:v1:common#/$defs/difficulty"
    },
    "ladder_ids": {
      "type": "array",
      "description": "這題在檢測哪些能力階梯行為（kit 正本）。必填且至少一條；產生題的其中恰一條必須有條件檔（generators/profiles/）。",
      "minItems": 1,
      "items": {
        "$ref": "urn:udl-content-spec:v1:common#/$defs/ladder_id"
      },
      "uniqueItems": true
    },
    "curriculum_codes": {
      "type": "array",
      "items": {
        "$ref": "urn:udl-content-spec:v1:common#/$defs/curriculum_code"
      },
      "uniqueItems": true
    },
    "strategy": {
      "type": "array",
      "items": {
        "type": "string",
        "minLength": 1
      }
    },
    "hints": {
      "$ref": "urn:udl-content-spec:v1:common#/$defs/hints"
    },
    "feedback": {
      "$ref": "urn:udl-content-spec:v1:common#/$defs/feedback"
    },
    "read_aloud_scope": {
      "type": "string",
      "enum": ["all", "stem", "none"],
      "description": "報讀範圍：all 題幹與選項都可唸；stem 只唸題幹（識字類選項不唸，否則變成聽音選字）；none 不唸。殼照做，事件照記 read_aloud。省略時殼用預設 all。"
    },
    "meta": {
      "type": "object",
      "properties": {
        "author": {
          "type": "string"
        },
        "reviewed": {
          "type": "boolean"
        }
      },
      "additionalProperties": false
    },
    "stem": {
      "$ref": "#/$defs/stem"
    },
    "options": {
      "$ref": "#/$defs/options"
    },
    "answer": {},
    "shuffle": {
      "type": "boolean"
    },
    "distractor_pool": {
      "$ref": "#/$defs/distractor_pool"
    },
    "pairs": {
      "$ref": "#/$defs/pairs"
    },
    "tolerance": {
      "$ref": "#/$defs/tolerance"
    },
    "unit_label": {
      "type": "string",
      "description": "數值答案的單位顯示，例如 顆。"
    },
    "input": {
      "$ref": "#/$defs/numeric_input"
    },
    "generator": {
      "type": "string",
      "pattern": "^[a-z0-9]+(\\.[a-z0-9-]+)+$",
      "description": "產生器 id，例如 math.add-2digit-carry。"
    },
    "generator_version": {
      "type": "integer",
      "minimum": 1
    },
    "params": {
      "type": "object"
    },
    "count": {
      "type": "integer",
      "minimum": 1,
      "description": "抽題時此產生器視為幾題。"
    },
    "blanks": {
      "$ref": "#/$defs/blanks"
    },
    "sequence": {
      "$ref": "#/$defs/sequence"
    },
    "bins": {
      "$ref": "#/$defs/bins"
    },
    "objects": {
      "$ref": "#/$defs/objects"
    }
  },
  "allOf": [
    {
      "if": {
        "type": "object",
        "properties": {
          "kind": {
            "const": "generated"
          }
        },
        "required": [
          "kind"
        ]
      },
      "then": {
        "type": "object",
        "required": [
          "generator",
          "generator_version",
          "params",
          "count"
        ],
        "properties": {
          "stem": false,
          "options": false,
          "answer": false,
          "pairs": false,
          "distractor_pool": false,
          "shuffle": false,
          "tolerance": false,
          "input": false,
          "unit_label": false,
          "blanks": false,
          "sequence": false,
          "bins": false,
          "objects": false
        }
      },
      "else": {
        "type": "object",
        "required": [
          "stem",
          "hints",
          "feedback"
        ],
        "properties": {
          "generator": false,
          "generator_version": false,
          "params": false,
          "count": false
        }
      }
    },
    {
      "if": {
        "type": "object",
        "properties": {
          "kind": {
            "const": "fixed"
          },
          "type": {
            "const": "choice"
          }
        },
        "required": [
          "kind",
          "type"
        ]
      },
      "then": {
        "type": "object",
        "required": [
          "options",
          "answer"
        ],
        "properties": {
          "answer": {
            "$ref": "urn:udl-content-spec:v1:common#/$defs/id",
            "description": "正解的 option id。"
          },
          "pairs": false,
          "tolerance": false,
          "input": false,
          "unit_label": false,
          "blanks": false,
          "sequence": false,
          "bins": false,
          "objects": false
        }
      }
    },
    {
      "if": {
        "type": "object",
        "properties": {
          "kind": {
            "const": "fixed"
          },
          "type": {
            "const": "true-false"
          }
        },
        "required": [
          "kind",
          "type"
        ]
      },
      "then": {
        "type": "object",
        "required": [
          "answer"
        ],
        "properties": {
          "answer": {
            "type": "boolean"
          },
          "options": false,
          "pairs": false,
          "distractor_pool": false,
          "shuffle": false,
          "tolerance": false,
          "input": false,
          "unit_label": false,
          "blanks": false,
          "sequence": false,
          "bins": false,
          "objects": false
        }
      }
    },
    {
      "if": {
        "type": "object",
        "properties": {
          "kind": {
            "const": "fixed"
          },
          "type": {
            "const": "match"
          }
        },
        "required": [
          "kind",
          "type"
        ]
      },
      "then": {
        "type": "object",
        "required": [
          "pairs"
        ],
        "properties": {
          "options": false,
          "answer": false,
          "distractor_pool": false,
          "tolerance": false,
          "input": false,
          "unit_label": false,
          "blanks": false,
          "sequence": false,
          "bins": false,
          "objects": false
        }
      }
    },
    {
      "if": {
        "type": "object",
        "properties": {
          "kind": {
            "const": "fixed"
          },
          "type": {
            "const": "numeric"
          }
        },
        "required": [
          "kind",
          "type"
        ]
      },
      "then": {
        "type": "object",
        "required": [
          "answer"
        ],
        "properties": {
          "answer": {
            "type": "number"
          },
          "options": false,
          "pairs": false,
          "distractor_pool": false,
          "shuffle": false,
          "blanks": false,
          "sequence": false,
          "bins": false,
          "objects": false
        }
      }
    },
    {
      "if": {
        "type": "object",
        "properties": {
          "kind": {
            "const": "fixed"
          },
          "type": {
            "const": "blanks"
          }
        },
        "required": [
          "kind",
          "type"
        ]
      },
      "then": {
        "type": "object",
        "required": [
          "blanks"
        ],
        "properties": {
          "options": false,
          "pairs": false,
          "answer": false,
          "tolerance": false,
          "input": false,
          "unit_label": false,
          "shuffle": false,
          "distractor_pool": false,
          "sequence": false,
          "bins": false,
          "objects": false
        }
      }
    },
    {
      "if": {
        "type": "object",
        "properties": {
          "kind": {
            "const": "fixed"
          },
          "type": {
            "const": "ordering"
          }
        },
        "required": [
          "kind",
          "type"
        ]
      },
      "then": {
        "type": "object",
        "required": [
          "sequence"
        ],
        "properties": {
          "options": false,
          "pairs": false,
          "answer": false,
          "blanks": false,
          "tolerance": false,
          "input": false,
          "unit_label": false,
          "shuffle": false,
          "distractor_pool": false,
          "bins": false,
          "objects": false
        }
      }
    },
    {
      "if": {
        "type": "object",
        "properties": {
          "kind": {
            "const": "fixed"
          },
          "type": {
            "const": "classify"
          }
        },
        "required": [
          "kind",
          "type"
        ]
      },
      "then": {
        "type": "object",
        "required": [
          "bins",
          "objects"
        ],
        "properties": {
          "options": false,
          "pairs": false,
          "answer": false,
          "blanks": false,
          "tolerance": false,
          "input": false,
          "unit_label": false,
          "shuffle": false,
          "distractor_pool": false,
          "sequence": false
        }
      }
    }
  ],
  "unevaluatedProperties": false,
  "$defs": {
    "stem": {
      "type": "object",
      "required": [
        "text"
      ],
      "properties": {
        "text": {
          "$ref": "urn:udl-content-spec:v1:common#/$defs/spoken_text"
        },
        "image": {
          "$ref": "urn:udl-content-spec:v1:common#/$defs/relative_path"
        },
        "alt": {
          "type": "string"
        },
        "listen": {
          "$ref": "#/$defs/listen"
        }
      },
      "additionalProperties": false
    },
    "listen": {
      "type": "object",
      "description": "聽音題（#36）：只播聲音、不顯示文字的題幹，給聽音選字、選語詞、選注音用。殼放「再聽一次」按鈕；題幹說明仍寫在 stem.text。不是 spoken_text，因為沒有要顯示的文字。",
      "required": [
        "audio"
      ],
      "properties": {
        "audio": {
          "$ref": "urn:udl-content-spec:v1:common#/$defs/relative_path",
          "description": "要播的音檔（包內相對路徑，只收 ASCII），必須列在 pack.json files。單音用共用單音包的檔名（音節鍵，例如 xing2.m4a），驗證器才能做同音字檢查。"
        },
        "repeat_max": {
          "type": "integer",
          "minimum": 0,
          "description": "第一次播放之後，最多還能再播幾次；0 表示只播一次，不填不限。"
        }
      },
      "additionalProperties": false
    },
    "options": {
      "type": "array",
      "minItems": 2,
      "maxItems": 6,
      "items": {
        "type": "object",
        "required": [
          "id",
          "text"
        ],
        "properties": {
          "id": {
            "$ref": "urn:udl-content-spec:v1:common#/$defs/id"
          },
          "text": {
            "$ref": "urn:udl-content-spec:v1:common#/$defs/spoken_text"
          },
          "image": {
            "$ref": "urn:udl-content-spec:v1:common#/$defs/relative_path"
          },
          "misconception": {
            "$ref": "urn:udl-content-spec:v1:common#/$defs/id",
            "description": "錯誤類型代碼（#43）：選這個選項代表哪一種錯誤想法；必須列在 pack.json misconceptions。正解選項不得帶。"
          },
          "feedback": {
            "$ref": "urn:udl-content-spec:v1:common#/$defs/spoken_text",
            "description": "逐選項回饋（#43）：練習模式選到這個錯誤選項時，殼優先顯示這段，沒有才用題目的 feedback.retry。"
          }
        },
        "additionalProperties": false
      }
    },
    "distractor_pool": {
      "type": "object",
      "description": "正解固定，從池抽 pick 個干擾項補足選項。",
      "required": [
        "pool",
        "pick"
      ],
      "properties": {
        "pool": {
          "$ref": "urn:udl-content-spec:v1:common#/$defs/id"
        },
        "pick": {
          "type": "integer",
          "minimum": 1,
          "maximum": 5
        }
      },
      "additionalProperties": false
    },
    "pairs": {
      "type": "array",
      "minItems": 2,
      "maxItems": 6,
      "items": {
        "type": "object",
        "required": [
          "id",
          "left",
          "right"
        ],
        "properties": {
          "id": {
            "$ref": "urn:udl-content-spec:v1:common#/$defs/id"
          },
          "left": {
            "$ref": "urn:udl-content-spec:v1:common#/$defs/spoken_text"
          },
          "right": {
            "$ref": "urn:udl-content-spec:v1:common#/$defs/spoken_text"
          }
        },
        "additionalProperties": false
      }
    },
    "tolerance": {
      "type": "object",
      "description": "數值答案容差：nominal 固定寬 |dx| ≤ value；relative |dx|/x ≤ value；geometric x/(1+value) ≤ x+dx ≤ x(1+value)。省略即為 nominal 0。",
      "required": [
        "type",
        "value"
      ],
      "properties": {
        "type": {
          "type": "string",
          "enum": [
            "nominal",
            "relative",
            "geometric"
          ]
        },
        "value": {
          "type": "number",
          "minimum": 0
        }
      },
      "additionalProperties": false
    },
    "numeric_input": {
      "type": "object",
      "properties": {
        "min": {
          "type": "number"
        },
        "max": {
          "type": "number"
        },
        "decimals": {
          "type": "integer",
          "minimum": 0,
          "maximum": 6
        }
      },
      "additionalProperties": false
    },
    "blanks": {
      "type": "array",
      "minItems": 1,
      "maxItems": 12,
      "items": {
        "oneOf": [
          {
            "type": "object",
            "required": [
              "id",
              "kind",
              "answer"
            ],
            "properties": {
              "id": {
                "$ref": "urn:udl-content-spec:v1:common#/$defs/id"
              },
              "kind": {
                "const": "numeric"
              },
              "answer": {
                "type": "number"
              },
              "tolerance": {
                "$ref": "#/$defs/tolerance"
              },
              "input": {
                "$ref": "#/$defs/numeric_input"
              },
              "unit_label": {
                "type": "string"
              }
            },
            "additionalProperties": false
          },
          {
            "type": "object",
            "required": [
              "id",
              "kind",
              "answer"
            ],
            "properties": {
              "id": {
                "$ref": "urn:udl-content-spec:v1:common#/$defs/id"
              },
              "kind": {
                "const": "text"
              },
              "answer": {
                "type": "string",
                "minLength": 1
              },
              "accept": {
                "type": "array",
                "items": {
                  "type": "string",
                  "minLength": 1
                },
                "uniqueItems": true
              },
              "case_sensitive": {
                "type": "boolean",
                "default": false
              },
              "max_length": {
                "type": "integer",
                "minimum": 1
              }
            },
            "additionalProperties": false
          }
        ]
      }
    },
    "sequence": {
      "type": "array",
      "minItems": 2,
      "maxItems": 8,
      "items": {
        "type": "object",
        "required": [
          "id",
          "text"
        ],
        "properties": {
          "id": {
            "$ref": "urn:udl-content-spec:v1:common#/$defs/id"
          },
          "text": {
            "$ref": "urn:udl-content-spec:v1:common#/$defs/spoken_text"
          },
          "image": {
            "$ref": "urn:udl-content-spec:v1:common#/$defs/relative_path"
          }
        },
        "additionalProperties": false
      }
    },
    "objects": {
      "type": "array",
      "minItems": 2,
      "maxItems": 12,
      "items": {
        "type": "object",
        "required": [
          "id",
          "text",
          "bin"
        ],
        "properties": {
          "id": {
            "$ref": "urn:udl-content-spec:v1:common#/$defs/id"
          },
          "text": {
            "$ref": "urn:udl-content-spec:v1:common#/$defs/spoken_text"
          },
          "image": {
            "$ref": "urn:udl-content-spec:v1:common#/$defs/relative_path"
          },
          "bin": {
            "$ref": "urn:udl-content-spec:v1:common#/$defs/id"
          }
        },
        "additionalProperties": false
      }
    },
    "bins": {
      "type": "array",
      "minItems": 2,
      "maxItems": 6,
      "items": {
        "type": "object",
        "required": [
          "id",
          "label"
        ],
        "properties": {
          "id": {
            "$ref": "urn:udl-content-spec:v1:common#/$defs/id"
          },
          "label": {
            "$ref": "urn:udl-content-spec:v1:common#/$defs/spoken_text"
          }
        },
        "additionalProperties": false
      }
    }
  }
}
