{
  "format_version": 1,
  "id": "i-gen-add-carry",
  "unit": "u02-add-2digit",
  "type": "numeric",
  "kind": "generated",
  "skill": "計算",
  "difficulty": 2,
  "ladder_ids": ["n-II-2#b@1"],
  "curriculum_codes": ["N-2-2"],
  "generator": "math.add-2digit-carry",
  "generator_version": 1,
  "params": { "min": 10, "max": 99, "require_carry": true },
  "count": 3,
  "hints": [
    { "text": "先算個位。", "audio": null },
    { "text": "個位相加超過 10，要向十位進 1。", "audio": null },
    { "text": "十位相加時別忘了加上進位的 1。", "audio": null }
  ],
  "feedback": {
    "correct": { "text": "答對了！", "audio": null },
    "retry": { "text": "再檢查一次有沒有進位。", "audio": null }
  }
}
